Link,Title,Location,Salary,Summary
https://kr.indeed.com/viewjob?jk=09771a6f79b71060,Business Data Analyst(Azar/Hakuna),하이퍼커넥트 서울,,Excel Preferred Qualifications Comfort with R... Python Familiarity with Bigquery and Data Studio 360 English language...
https://kr.indeed.com/viewjob?jk=530a598184580c95,데스크탑 가상화(VDI) 엔지니어 모집,카카오 4.0 성남 판교역,,"기본적 이해 리눅스 시스템에 대한 기본적 이해 우대사항 시스템 엔지니어 경력자 Powershell, Python, Shell 스크립트를 이용한 인프라 관리 자동화 경험자 부드러운 커뮤니케이션, 친절한 마인드의 소유자..."
https://kr.indeed.com/viewjob?jk=4cf22ca4d39d690a,고용노동부 주최 K-Digital 사업 / 의료인공지능 핵심인력양성사업...,건양대학교 산학협력단 충청남도 논산,,바일·게임>응용프로그래머> Python|인터넷·IT·통신·모바일·게임>응용프로그래머>JAVA|인터넷·IT·통신·모바일·게임>응용프로그래머>홀로그램|인터넷·IT·통신·모바일·게임>웹프로그래머> Python|인터넷·IT·통신·모바일...
https://kr.indeed.com/viewjob?jk=6718bba08ef6e20b,모바일 앱 보안 솔루션 개발부문,스틸리언 서울 용산구,,"Android/iOS 모바일 앱 보안 제품입니다. - 앱수트는 C, Python 등을 통해 주로 개발합니다. - 앱수트 제품군에는 위변조 방지, 난독... 2) - Objective C, Python, C언어, Swift 개발..."
https://kr.indeed.com/viewjob?jk=ab88cfaddfc40242,(주)맥시멈코퍼레이션 하반기2차 신입ㆍ경력 사원 채용 (S/W프로그래머),맥시멈코퍼레이션 관심기업 사천 용현면,,"무관, 경력무관 학력무관 우대조건 QT Framework 개발우대 , Python 개발우대 기업정보 2019년 설립(업력 2년) 사원 4명 비상장... 개발우대 - 직접 : Python 개발우대 인원 0명 근무 환경 고용형태..."
https://kr.indeed.com/viewjob?jk=19b7736d5aa3f7e5,Machine Learning Research - Speech Recog...,Qualcomm Korea YH 서울,,experience in machine learning Programming skill in Python or C/C++ Experience in PyTorch (preferred) or TensorFlow...
https://kr.indeed.com/viewjob?jk=1dfcccd87594a1a8,Production Data Analyst,하이퍼커넥트 서울,,활용할 수 있도록 가이드 Minimum Qualifications 능숙한 SQL 구현 역량 R 또는 Python 분석 코드 구현 역량 Preferred Qualifications 데이터 관련 분야 학위 보유 머신러닝...
https://kr.indeed.com/viewjob?jk=bcd2f0630e298aa3,클라우드 인프라 운영 담당자 모집,넷마블 서울 구로구,,"기술적인 문제점 파악 및 해결 스킬 우대 사항 - 유관 경력 5년 이상 - 인터프리터 언어 숙련자 ( Python, Ansible 등) - 컴퓨터 관련 전공 이수자 우대 - 네트워크 기본 역량 - 게임사/포탈 인프라..."
https://kr.indeed.com/viewjob?jk=2a2fd0d9b3acfaa9,DBA,비바리퍼블리카 서울 강남구,,분 Shell 운영 스크립트 개발이 가능하신 분 우대 사항 NoSQL (MongoDB) 운영경험이 있는 분 Python 개발이 가능하신 분 인터넷·IT·통신·모바일·게임>데이터베이스·DBA>MySQL|인터넷·IT·통신·모바일...
https://kr.indeed.com/viewjob?jk=413140a00f34e752,IT 웹/응용/시스템프로그래머,이루텔럭키 경기도 군포,"연봉 26,000,000원 - 28,000,000원","지원자격 경력 신입·경력 학력 - 성별 무관 기타 담당업무 * Python flask를 이용한 서비스 개발 지원 및 서버프로그램 개발지원 신입사원 모집 솔루션 개발 및 유지보수 (사물인터넷, 웹, 머신러닝 플랫폼) 상세모집..."
https://kr.indeed.com/viewjob?jk=85687b250386c4be,qe 소프트웨어 엔지니어,에이치알 코리아 대한민국,,"process improvements • Strong scripting experience with Python, Shell Scripts, Ruby, etc. • Ability to code competently..."
https://kr.indeed.com/viewjob?jk=e9545f50634d1aca,시스템 엔지니어 모집,엔씨소프트 2.7 성남 판교역,,"론칭 및 글로벌 운영 경험 우대사항 - IaC 자동화 도구/스크립팅 (Terraform, Ansible & Python, OS 별 스트립트 개발) - SRE 기반 엔지니어링 경험자 - 퍼블릭/프라이빗 클라우드 솔루션 아키텍트..."
https://kr.indeed.com/viewjob?jk=47b222895fa96ecb,Data Scientist 경력인재 - 글로벌 우량대기업,에스에프인촌 서울,,업무 유경험자 (1) 데이터 분석/모델링 수행업무 유경험자 - R/ Python/SAS 등의 분석 Tool을 활용하여 정형/비정형 데이터 분석 수행... 게임>빅데이터·AI(인공지능)> Python|인터넷·IT·통신·모바일·게임...
https://kr.indeed.com/viewjob?jk=180d95bdcbacaa08,AI 서비스 데이터 분석가 모집,엔씨소프트 2.7 성남 판교역,,"과정 상의 여러 의사결정에 뒷받침되는 데이터 분석 설계 - SQL, Python 등을 활용한 서비스 로그 데이터 핸들링 및 인사이트 도출 2. 서비스... 이해가 있으신 분 - SQL, Python 등 데이터 분석에 필요한 언어에..."
https://kr.indeed.com/viewjob?jk=09771a6f79b71060,Business Data Analyst(Azar/Hakuna),하이퍼커넥트 서울,,Excel Preferred Qualifications Comfort with R... Python Familiarity with Bigquery and Data Studio 360 English language...
https://kr.indeed.com/viewjob?jk=b966810974ac84da,"Technical Solutions Engineer, Wear OS (E...",Google 4.3 서울,,"developing web applications and programming languages (e.g., Python, Go, Java, JVM Hotspot, HTTP, HTTPS). Ability to speak..."
https://kr.indeed.com/viewjob?jk=7b6debf81473e7a2,[주식회사 에잇퍼센트][웹 개발자(Python)청년디지털일자리.일경험지원...,에잇퍼센트 서울 여의도,,수 있음 손작업 : 선택 안함. 양손사용 : 양손으로 작업 기타우대사항 우대사항 <br>•&nbsp; Python을&nbsp;현재&nbsp;사랑하고&nbsp;계시거나&nbsp;앞으로&nbsp;사랑하실&nbsp;수&nbsp...
https://kr.indeed.com/viewjob?jk=7bf179a290a157b2,경험최적화파트 - 머신러닝 엔지니어,Nexon 성남 분당구,,모델 개발 - 머신러닝을 위한 솔루션 프로토타이핑 - 머신러닝 파이프라인 설계 및 구축 지원자격 - Python에 숙련된 프로그래밍 능력과 머신러닝 라이브러리 활용 경험 - 머신러닝과 강화학습에 관련된 지식 습득 혹은...
https://kr.indeed.com/viewjob?jk=072b5b83539aae58,"KOREA, Connect Specialist SA",Amazon Web Services Korea LLC 서울,,"passion for getting hands dirty with code/scripting (e.g, python, java, c#, .NET, Node.js) · Native Korean · Business level..."
https://kr.indeed.com/viewjob?jk=a4015a0d112e9569,프론트엔드 정규직,바이오에이아이 서울 강남구,,"프론트 엔드 구현 - DB 구축 - 신규 기능 개발 및 반영, 지속적인 개선 및 유지 보수 자격 조건 - Python, Django - RDBMS 경험 - UI개발 경험 우대 사항 - 딥러닝에 관심있으신 분 - 단위 테스트..."
https://kr.indeed.com/viewjob?jk=90154770c84104a9,청년디지털일자리 연구 논문과 빅데이터 분석가,히든그레이스 서울 서초구,"월급 2,000,000원","서초구 강남대로 도씨에빛 2, 1801호 / (주)히든그레이스 인근지하철 직무내용 논문에 대한 이해 R과 python 활용 능력 [정보기술>정보기술전략·계획>빅데이터 분석] 통계 기반 데이터 분석 가설 설정하기,통계 모델..."
https://kr.indeed.com/viewjob?jk=1ed946a28f319e1e,[큐셀]BD&Tech부문 시스템개발센터 경력직 [시스템개발팀 Data S...,한화솔루션 서울 중구,,"분석 전략 수립 경험 보유자 - Machine Learning/Deep learning 개발경험 보유자 - Python (C/C++) 언어 개발 능력 보유자 - PyToch, Keras, Tensorflow, AWS 상의..."
https://kr.indeed.com/viewjob?jk=ad3dfd853ea7ef40,Credit Risk 모델러,Toss 서울 강남구,,"에 대한 폭넓은 이해와 분석적 능력을 보유하신 분 - SAS, SQL, KnowlegeSEEKER, Python, R 등 Tool사용 가능하신 분 - 원활한 커뮤니케이션 가능하신 분 # 우대 사항 - 바젤 및 IFRS9관련..."
https://kr.indeed.com/viewjob?jk=3c516818303c4d51,Application Engineer ( Silicondash),Synopsys 서울,,"disk access Programming skill of TCL, Perl, JavaScript or Python Good documentation and reporting skills are required..."
https://kr.indeed.com/viewjob?jk=5123207a169f90eb,Software Developer - Front-End / Back-En...,AITRICS 서울,,"purpose programming languages including C++, Java, Javascript, Python. Eager to learn a new programming language and machine..."
https://kr.indeed.com/viewjob?jk=7bd59201a82e59ed,[신규프로젝트] 차세대 콘솔 Maya 리거 채용,엔씨소프트 2.7 성남 판교역,,"동학, 변형 및 토폴로지에 대한 지식 - 캐릭터 제작 파이프 라인 및 워크 플로우 기술에 대한 지식 - Python, MEL,또는 기타 프로그래밍 언어 경험 - 문제 해결 능력 - 언리얼 등 상용엔진 응용 사용 경험 - 리깅..."
https://kr.indeed.com/viewjob?jk=e3433f778853cca7,[청년 디지털 일자리] 백엔드 개발자,에이치엠 대구 동구,"월급 2,000,000원 - 2,200,000원","주5일) - 월 200만원 (경력자는 면접 후 협의) - 근무지역 (대구 동구 용계동, 대구 동구 율하동) Python, MySQL 활용 가능자 [우대사항] - 정보처리기사 - 컴퓨터공학 관련 전공 상세모집요강 접수기간..."
https://kr.indeed.com/viewjob?jk=b508dd767d11b243,"응용소프트웨어,소프트웨어개발,SW, PLC프로그램, 프로그래머",스마탑 대구 달서구,"연봉 24,000,000원 - 26,000,000원","성별 무관 기타 담당업무 소프트웨어개발 프로그래머 SW개발 프로그램 개발 응용프로그램(2명): C++, Python, Delphi 등 1개이상 언어사용자 PLC 프로그램(1명) Machine Vision(머신러닝), Deep..."
https://kr.indeed.com/viewjob?jk=44a3ecc3e34a08c0,"대기업 경로탐색 교통정보 분석 (GIS, python, sql)",차량IT 전문 기업 (대기업) 서울,,"4년~12년 경력자 - 데이터 분석 경력 3년 이상 - 경로탐색 알고리즘 이해 [기술 스택] - 언어 : python, sql(spatial) - SW : 범용 GIS SW(Q-GIS 등) [우대역량 및 경험] - 교통정..."
https://kr.indeed.com/viewjob?jk=68875cf86f31569e,ERP 담당자 모집,넷마블 서울 구로구,,"기반 ERP Web Portal 시스템개발/운영 경력 3~9년 보유자 - Spring (혹은 .NET, Python 등) 프로그래밍 가능자 - 시스템 분석/설계 가능자 - 재무/회계 기본 지식 보유자 우대사항 - IT 프로젝..."
https://kr.indeed.com/viewjob?jk=6b86ea39985912b6,TOAST Cloud 사업기획/영업,NHN 4.4 성남 판교역,,"Linux, Microsoft Solutions 등) - 2년 이상의 개발 경험 (Java, Python 등) - 기술 문서 작성 및 가이드 경험이 풍부한 자 - 대외 고객 기술 지원 경험 공통지원자격..."
https://kr.indeed.com/viewjob?jk=934bcac6e0765bb9,Solutions Architect,NVIDIA 서울,,"Computer Engineering. Work or research experience with Python, C/C++ software development. A proven track record of academic..."
https://kr.indeed.com/viewjob?jk=57a546aba8188299,iOS 개발자,스포카 대한민국,,"학습에 대한 열정: 현재 스포카 크리에이터는 MSA기반의 서비스를 운영하고 있으며, 언어로는 Kotlin, Python, TypeScript, Rust, C#, Haskell 등 다양한 언어를 사용 중입니다. 웹/앱 관련하여..."
https://kr.indeed.com/viewjob?jk=ceb8243bc8ae3c35,[데이터 플랫폼]데이터 엔지니어 (전문연구요원 가능),버즈니 서울,,및 유지보수 이런 분을 찾습니다 관련 업무 경력 최소 3년 이상 있으신 분 (전문연구요원의 경우 경력 무관) Python 및 기반 데이터 플랫폼 개발 경험이 있으신 분 Docker(Contatiner) 기반 시스템 환경 구축...
https://kr.indeed.com/viewjob?jk=5cb14c0712a6c4c1,시스템 엔지니어링,NHN 4.4 성남 판교역,,"Windows OS 스킬 보유 및 X86 서버 운영 경험 보유 - 기본적인 운영도구 개발 가능자 * Python, Django, JAVA - 웹 서비스 또는 플랫폼 개발 경력 보유자 - OpenStack 기반의..."
https://kr.indeed.com/viewjob?jk=611a08c9fbbafbc4,[공통기술부문] DBA,우아한 형제들 서울 송파구,,"AWS 관리 운영 역량 보유 - 리눅스 운영 경험 - 자동화 작업, 배치 개발역량 보유(shell, python, nodejs 등) - SQL Tuning 역량 보유 [우대사항] - NoSQL 운영 경험이 있는 분..."
https://kr.indeed.com/viewjob?jk=0b05f7fff851371a,게임 런처 개발,Nexon 성남 분당구,,업무소개] - 넥슨 글로벌 플랫폼의 게임 클라이언트 배포 시스템 및 어플리케이션 개발 지원자격 - C++ 혹은 Python 프로그래밍 언어 능숙자 - 비동기 및 병렬처리 프로그래밍 경험 우대사항 - Modern C++...
https://kr.indeed.com/viewjob?jk=318d81c0ecad4917,지구 구하는 영웅들 위하여! 백엔드 개발자 !,오이스터에이블 서울 용산구,"월급 2,000,000원","소스 버전 제어 (Git), NPM, Nodemon 등에 대한 경험 우대사항 기타 언어 : JSP, Python. 알고리즘 : 이미지 인식, 기계 학습, 데이터 처리 및 분석. 기타 : Firebase, GraphQL..."
https://kr.indeed.com/viewjob?jk=30397f4de3627e9d,Data Engineer,Toss 서울 강남구,,"등) 활용 경험이 있으신 분 - 데이터 분석도구 개발을 위한 소프트웨어 개발 역량(Java, Scala, Python 등)을 갖추신 분 # 우대 사항 - Kinesis, Kafka 구축 및 운영 경험 - 중급 이상의 프로그래..."
https://kr.indeed.com/viewjob?jk=bbbe9929376a2d53,"Applications Engineer, Staff (IC Validat...",Synopsys 서울,,"control, bug tracking Knowledge of Shell, Perl, Python or TCL scripting is a plus. Excellent teamwork and communication..."
https://kr.indeed.com/viewjob?jk=fe6813a84b07d6af,[기술기획] DevOps 플랫폼 개발자,한국카카오은행 성남 분당구,,"구성/운영한 경험이 있는 분 · Python, Java, Golang 중... 프로그래머> Python|인터넷·IT·통신·모바일·게임>응용프로그래머>JAVA|인터넷·IT·통신·모바일·게임>웹프로그래머> Python|인터넷·IT·통신..."
https://kr.indeed.com/viewjob?jk=5c45a3d19019f932,Data Engineer,Soomgo 서울 강남구,,레이크나 웨어하우스 구축 및 운영 경험 • 대용량 트래픽 분산과 처리에 대한 관심 및 경험이 있는 분 • Python 3.6 이상 능숙 • Airflow 또는 Kafka 구축 및 운용 경험 • Google Analytics...
https://kr.indeed.com/viewjob?jk=e9e86127df39c006,[Search] 검색 서버 개발 & DevOps 엔지니어 (신입),네이버 서울,,"우대사항] [ 신 입 ] · Unix/Linux 환경에서의 개발 경험이 있으신 분 · C++, Go, Python 등 하나 이상의 프로그래밍 언어로 서버 개발이 가능하신 분 · 컨테이너 및 자동화 기술에 대한 관심이..."
https://kr.indeed.com/viewjob?jk=cd9197177230109e,[유명 소프웨어 기업] 데이터 분석(6년이상),디에스파트너즈그룹 서울 서초구,,"비즈니스의 이해 능력 - 데이터 분석 업무를 수행할 수 있는 하나 이상의 언어 스킬 필수 (예. SQL, Python, R 등) - 복잡한 분석 결과에 대한 문서화 기술역량을 보유한 분 - 분석결과에 대한 명확한 의사소통과..."
https://kr.indeed.com/viewjob?jk=d480b37864cba4bc,[앰진시큐러스] 백엔드 개발자(Python/Java/C/C++),앰진시큐러스 서울 문정동,"연봉 28,000,000원","문정동) 5층(문정동,수성위너스) 501,502,503호 인근지하철 직무내용 * 백엔드 개발자 채용( Python/Java/C/C++) - 대졸이상 - 신입 또는 경력 1년 이상 - 관련학과 전공자/ 관련 자격증 소지자..."
https://kr.indeed.com/viewjob?jk=bfd257c0c149df29,데이터분석 담당자,더블유게임즈 서울 강남구,,"결과를 유관 부서에 효과적으로 전달하기 위한 시각화 자격 요건 - 통계 지식 및 관련 툴(SQL, R, Python 등)을 사용한 데이터 분석 능력 - 데이터를 기반으로 도출 된 결과를 문서화 할 수 있는 능력 - 데이터를..."
https://kr.indeed.com/viewjob?jk=d017610d9828199c,"드론 데이터 스타트업, 엔젤스윙 엔지니어",엔젤스윙 서울 관악구,,"Ruby on Rails, Python, C++, AWS AWS, GCP... 기반 웹서비스 개발 경험 디버깅, 최적화 스킬 Javascript, Python, C++ 등 개발언어 중 자신있는 언어가 1가지 이상 있으신 분..."
https://kr.indeed.com/viewjob?jk=74d66a601cc8dde0,DBA,Toss 서울 강남구,,DBA 3년 이상) 경험 있으신 분 - SQL을 숙련되게 다루시는 분 - Shell 운영 스크립트 개발이 가능하신 분 # 우대 사항 - NoSQL (MongoDB) 운영경험이 있는 분 - Python 개발이 가능하신 분
https://kr.indeed.com/viewjob?jk=658c0943dbed7b59,[TGD] Data Scientist 모집,엔씨소프트 2.7 성남 판교역,,"자격 학력 : 석사 이상 경력기간 : 5년 ~ 10년 필수조건 DB 성능까지 고려한 SQL 프로그래밍 가능자 Python을 이용한 데이터 분석 3년 이상 경력자 (SAS, SPSS 등 통계툴만 사용 가능한 경우 제외) 대용량..."
https://kr.indeed.com/viewjob?jk=bc5c2ede8d8bf636,[신입/경력] 음성인식 연구원,뷰노코리아 서울 서초구,,인터넷·IT·통신·모바일·게임>응용프로그래머>C·C++|인터넷·IT·통신·모바일·게임>응용프로그래머> Python|인터넷·IT·통신·모바일·게임>웹프로그래머> Python
https://kr.indeed.com/viewjob?jk=1888ee91da93366d,Chief Technology Officer,Asiance 서울,,"mainly. • 배포는 주로 Docker 사용. • Python, Node.js, Java, PHP for backend development. • Python, Node.js, Java, PHP 등을 사용하여 백엔드..."
https://kr.indeed.com/viewjob?jk=78d1ec77f4a5e0dc,기후 분석&모델링연구실 시간제연구원,광주과학기술원 광주 북구,,"수행 ① 국내외 4년제 대학교 환경공학관련분야 학사 이상 학위소지자로서, ② Fortran, GrADS, python 중 1개 이상의 프로그램 언어 사용 가능자 우대사항 ① 국가보훈대상자(취업보호대상자) 및 장애인은..."
https://kr.indeed.com/viewjob?jk=5f9f2df6b4e3ba4f,Database Consultant,www.enterprisedb.com 서울 강남역,"연봉 101,351,696원","scripting languages like BASH, KSH, Python, Perl etc.. * Working knowledge of MS... like C, C++, PHP, python, Java or Ruby..."
https://kr.indeed.com/viewjob?jk=981472efa04e321e,Simulations and AI Engineer,Unity Technologies 서울,,"experience in one... following languages: C#, C++, Python, or Java Experience in one... following libraries..."
https://kr.indeed.com/viewjob?jk=c53e8bbdcd7076f2,[해외취업] 고급 IT 엔지니어,株式会社ASCOM 대한민국,,"일본어 능력은 상관없음.  python,C++,C,C#,ASP.net,JAVA,VB.net,swift,IOS,Android,kotlin 중 한가지 이상 개발 경력이 3년 이상인 자. [ python] * AI, 사물 인터넷..."
https://kr.indeed.com/viewjob?jk=e0921be1bc6e2ffd,"Java, Python 백엔드 개발자 경력 정규직",아이넷테크 대전 유성구,,수양식: 인크루트 이력서 기타 유의사항 입사지원서 및 제출서류에 허위사실이 있을 경우 채용이 취소될 수 있습니다. 인터넷·IT·통신·모바일·게임>응용프로그래머>JAVA|인터넷·IT·통신·모바일·게임>응용프로그래머> Python
https://kr.indeed.com/viewjob?jk=cd5ca556791f1f79,[브랜디] 경영본부/사업본부/개발직군 신입 및 경력,브랜디 서울 강남구,,"수 있는 분 - SQL, R, Python 등 데이터 관련 언어 사용이... 형상관리에 대한 이해 - (경력) 웹 서비스 개발 경험 - (경력) Python 유경험자 - (경력) AWS, Azure 등 클라우드 환경 프로젝트..."
https://kr.indeed.com/viewjob?jk=ee987172a7b12be0,자율협력주행 온라인 박람회,한국도로공사 서울,,통신·모바일·게임>빅데이터·AI(인공지능)>데이터분석|인터넷·IT·통신·모바일·게임>빅데이터·AI(인공지능)> Python|인터넷·IT·통신·모바일·게임>빅데이터·AI(인공지능)>머신러닝|인터넷·IT·통신·모바일·게임>빅데이터...
https://kr.indeed.com/viewjob?jk=4eff6a88fdd7bb0b,데이터 분석가,스포카 대한민국,,"성을 주도적으로 제시할 수 있는 분을 찾습니다. 우대 사항 1가지 이상의 프로그래밍 언어를 구사하시는 분: Python, R 등의 프로그래밍 언어를 1개 이상 능숙하게 사용 가능하신 분이면 좋습니다. 데이터 웨어하우징 인프라..."
https://kr.indeed.com/viewjob?jk=f17a32475bc617a9,Data Scientist (인턴),데브시스터즈 서울 신사동,,제품 개선 지원자격 -Programming: 데이터 핸들링을 위한 기본적인 프로그래밍 지식(R 또는 Python) -Math: 탄탄한 수학적 기본 -구조적 사고: 데이터를 기반으로 현상을 이해하고 해석할 수 있는...
https://kr.indeed.com/viewjob?jk=a2b8aae664300392,신한AI 인공지능(AI) 인력,신한에이아이 서울 영등포구,,"련전공 : 인공지능 / 수학 / 산업공학 / 컴퓨터공학 / 통계 관련 [우대사항] - 프로그래밍 숙련자 ( python 外 C++, Java 등) - 금융데이터 또는 시계열 데이터 기반 인공지능 모델 구축 및 운영경험 - 강화..."
https://kr.indeed.com/viewjob?jk=a84b5655343a0228,DRX 인재 공개,디알엑스 서울 구로구,,"방안 수립 ㆍ데이터 모델/알고리즘 설계, 개발 및 정리 필수사항 ㆍ데이터 분석 관련 경력 2년 이상 ㆍR, Python, SQL, Excel 등을 이용한 프로그램 개발 능력자 ㆍ기계 학습 모델 실무 또는 프로젝트 경험 1년..."
https://kr.indeed.com/viewjob?jk=25725b3c0e607311,Junior Quant Trader,Byzantine Partners 서울,,background is a plus Programming capability is mandatory (i.e. Python) Understanding of machine learning algorithm is a plus...
https://kr.indeed.com/viewjob?jk=c89ccc7fac19d9fd,(주)코인플러그 서버 개발자 (신입 가능/전문연구요원/산업기능요원 보충역...,코인플러그 성남 분당구,,"습득하고 업무에 적용하는데 능숙한 분 - 블록체인 기술에 관심이 많은 분 [우대사항] - goLang, python, Java, kotlin, node.js 중 한가지 언어 이상 개발 경험 - RDBMS / NoSQL 개발..."
https://kr.indeed.com/viewjob?jk=3b0e3b290f637baf,효성첨단소재(주) 타이어보강재PU 빅데이터 분석 경력사원,2018.10.07 24시 대한민국,,인공지능 기술 지원 - 데이터연계 및 모니터링 화면 개발 지원 2. 경력 및 우대사항 - R/ Python 프로그래밍 가능자 - 딥러닝 또는 통계툴 활용 경험자 - 제조설비 센서데이터를 활용한 빅데이터...
https://kr.indeed.com/viewjob?jk=0601c7f1adb75903,"Senior Data Scientist, Korea",Visa 서울,,analytics/programming tools... SAS/Salford SPM/Hadoop/R/SQL/ Python/Hive Proficiency in some... following statistical...
https://kr.indeed.com/viewjob?jk=f4190a8dbb8c05b1,[AI R&D] Language AI(NLP) Research 분야 수시...,엔씨소프트 2.7 성남 판교역,,"분 - 통계/Machine Learning에 대한 이해와 활용 능력 및 text 처리 기술에 대한 경험 - Python, Java 등을 이용하여 NLP 기술을 구현 가능한 분 - 최신 기술(논문, 기술문서 등)을 습득하는..."
https://kr.indeed.com/viewjob?jk=07375dc4e800dfa9,추천 시스템 소프트웨어 엔지니어,카카오 4.0 성남 판교역,,"관련 업무 경험자 우대사항 운영체제, 네트워크, 컴파일러, 데이터베이스에 대한 이해가 깊으신 분 Python, C++, GPU 프로그래밍 숙련자 대용량/실시간 서비스 개발/운영 경험이 많으신 분 ICPC/TopCoder..."
https://kr.indeed.com/viewjob?jk=22b73f0da2fbd79f,[해외취업] Web 오픈계 엔지니어,글로벌트러스트네트웍스코리아 대한민국,,"등) 거래처 신용관리 시스템 개발 (VB.net, Oracle) AI 기술 개발, 빅데이터 분석 ( Python, Hadoop, Mongo DB, Angular 등) RPA 도입 지원 (VBA, UiPath, Winactor..."
https://kr.indeed.com/viewjob?jk=7fdcd7a7457b1e93,데이터 분석 및 지표 구축,아프리카TV 경기도 성남,,"소비형태/이상현상과 트렌드 변화가 궁금하신분 - 신입 / 경력 [우대사항] -SQL,Excel,R, Python 등을 이용하여 데이터 추출 또는 분석이 가능하신 분 -기계학습, Deep Learning을 이용한 예측..."
https://kr.indeed.com/viewjob?jk=a746de9c7a6168ef,Healthcare Real World Data Analyst 담당자,IQVIA 서울,,"HEOR 전반적인 업무 수행 Qualifications Claims Data 관련 분석 경력자 SAS / Python / R 등 통계 프로그래밍 언어 사용 가능자 통계학 전공자, 통계 및 Epidemiology 관련 석사..."
https://kr.indeed.com/viewjob?jk=3b752abecf619fe5,채팅모듈 개발자,Nexon 성남 분당구,,"대사항 - 대규모 동시 접속 및 고용량 데이터 처리 경험 - Unix/Linux 시스템에 대한 이해 - Python, Java, Event-Driven Framework에 대한 이해 - TCP/IP와 네트워크 프로그래밍..."
https://kr.indeed.com/viewjob?jk=269ce808b8a75923,[신입/정규] 광고 솔루션 개발 (Python),니트머스 서울 중구,"연봉 25,000,000원 - 30,000,000원","Python) 모집 모집부문 및 자격요건(""청년 디지털 일자리 사업"" 참여 중) 담당업무 자격요건 인원 [담당업무] 광고 솔루션 개발 ( python... 소될 수 있습니다. 인터넷·IT·통신·모바일·게임>웹프로그래머> Python"
https://kr.indeed.com/viewjob?jk=a41d35173ffe4666,[Search] [Vision] Computer Vision Engine...,네이버 서울,,"스템 엔지니어링 · 스마트렌즈 , 이미지 / 동영상 검색 , 비주얼 커머스 서비스 고도화에 기여 [자격요건] · Python, C++, Golang, Scala 등의 백엔드 개발 언어를 1 개 이상 자유롭게 활용 가능한 분..."
